#PMID	PMCID	TITLE	LANGUAGE
32243621		COVID-19 Pneumonia as a Cause of Acute Chest Syndrome in an Adult Sickle Cell Patient.	
32185669		COVID-19 pneumonia: infection control protocol inside computed tomography suites.	
32105641		COVID-19 pneumonia: what has CT taught us?	
32236303		COVID-19 pneumonia: what is the role of imaging in diagnosis?	
32216866		COVID-19 positive test result from private hospital laboratory, neglecting on reporting and problem on national infection control.	
32154911		COVID-19 Presents High Risk to Older Persons.	
32227671		COVID-19 Related School Closings and Risk of Weight Gain Among Children.	
32221512		COVID-19 Research in Brief: 20 March to 27 March, 2020.	
32213488		Covid-19 risks and response in South Asia.	
32237287		COVID-19 Testing in South Korea: Current Status and the Need for Faster Diagnostics.	
32151714		COVID-19 Therapeutic and Prevention.	
32224550		COVID-19 threatens health systems in sub-Saharan Africa: the eye of the crocodile.	
32227357		COVID-19 treatment by repurposing drugs until the vaccine is in sight.	
32164830		COVID-19 with spontaneous pneumomediastinum.	
32153144		COVID-19, A Clinical Syndrome Manifesting as Hypersensitivity Pneumonitis.	
32224712		COVID-19, a UK perspective.	
32228252		COVID-19, ACE2 and the Cardiovascular Consequences.	
32050080		COVID-19, Australia: Epidemiology Report 2 (Reporting week ending 19:00 AEDT 8 February 2020).	
32074480		COVID-19, Australia: Epidemiology Report 3 (Reporting week ending 19:00 AEDT 15 February 2020).	
32098616		COVID-19, Australia: Epidemiology Report 4 (Reporting week ending 19:00 AEDT 22 February 2020).	
32126197		COVID-19, Australia: Epidemiology Report 5 (Reporting week ending 19:00 AEDT 29 February 2020).	
32156224		COVID-19, Australia: Epidemiology Report 6 (Reporting week ending 19:00 AEDT 7 March 2020).	
32192424		COVID-19, Australia: Epidemiology Report 7 (Reporting week ending 19:00 AEDT 14 March 2020).	
32223725		COVID-19, Australia: Epidemiology Report 8 (Reporting period from 19:00 AEDT 14 March to 23:59 AEDT 22 March 2020).	
32202240		COVID-19, cytokines and immunosuppression: what can we learn from severe acute respiratory syndrome?	
32212141		COVID-19, guests and crews of cruise: observation on Thai citizens.	
32232551		COVID-19, rheumatic diseases and immunosuppressive drugs: an appeal for medication adherence.	
32212930		COVID-19, Risk, Fear, and Fall-out.	
32234451		COVID-19, SARS and MERS: are they closely related?	
32207541		COVID-19, Urologists and Hospitals.	
32216864		"COVID-19: ""A Tale of Two Epidemics"" March 20, 2020."	
32220877		"Covid-19: ""Illogical"" lack of testing is causing healthy staff to self-isolate, BMA chief warns."	
32198153		"Covid-19: 15 000 deregistered doctors are told, ""Your NHS needs you""."	
32139397		Covid-19: 90% of cases will hit NHS over nine week period, chief medical officer warns.	
32122876		Covid-19: a digital epidemic.	
32198918		COVID-19: a fast evolving pandemic.	
32202064		COVID-19: A Global Transplant Perspective on Successfully Navigating a Pandemic.	
32235915		COVID-19: a new challenge for human beings.	
32075791		Covid-19: a puzzle with many missing pieces.	
32196083		COVID-19: a recommendation to examine the effect of hydroxychloroquine in preventing infection and progression.	
32213507		Covid-19: a remote assessment in primary care.	
32198801		COVID-19: A Singapore Orthopedic resident's musings in the Emergency Department.	
32243122		COVID-19: a time of crisis, but also of surgical opportunity and optimism	
32243123		COVID-19: a time of crisis, but also of surgical opportunity and optimism	
32205272		COVID-19: Active measures to support community-dwelling older adults.	
32188602		Covid-19: all non-urgent elective surgery is suspended for at least three months in England.	
32229647		COVID-19: An Unintended Force for Medical Revolution?	
32164424		COVID-19: An Update on the Epidemiological, Clinical, Preventive and Therapeutic Evidence and Guidelines of Integrative Chinese-Western Medicine for the Management of 2019 Novel Coronavirus Disease.	
32078596		COVID-19: another infectious disease emerging at the animal-human interface.	
32144115		Covid-19: are we getting the communications right?	
32210384		COVID-19: ban 'orientalism' by critics of wildlife trade.	
32218525		COVID-19: Biomedical research in a world under social-distancing measures.	
32184208		Covid-19: BMA calls for rapid testing and appropriate protective equipment for doctors.	
32241762		Covid-19: Can France's ethical support units help doctors make challenging decisions?	
32198179		Covid-19: cases grow in US as Trump pushes promise of a malaria drug.	
32241193		COVID-19: Challenges and opportunities for dermatology response.	
32160997		Covid-19: China's president Xi visits Wuhan amid confidence that virus is under control.	
32113509		COVID-19: combining antiviral and anti-inflammatory treatments.	
32192578		COVID-19: consider cytokine storm syndromes and immunosuppression.	
32234719		Covid-19: Contact tracing requires ending the hostile environment.	
32198146		Covid-19: control measures must be equitable and inclusive.	
32238354		Covid-19: death rate is 0.66% and increases with age, study estimates.	
32208494		COVID-19: decision making and palliative care.	
32220832		Covid-19: diabetes clinicians set up social media account to help alleviate patients' fears.	
32209558		Covid-19: doctors are given new guidelines on when to admit patients to critical care.	
32224494		Covid-19: Doctors are told not to perform CPR on patients in cardiac arrest.	
32205356		Covid-19: doctors in final trimester of pregnancy should avoid direct patient contact.	
32217522		Covid-19: doctors' leaders warn that staff could quit and may die over lack of protective equipment.	
32234713		"Covid-19: Doctors still at ""considerable risk"" from lack of PPE, BMA warns."	
32241811		Covid-19: doctors' visas are automatically extended for one year.	
32184206		Covid-19: Doctors warn of humanitarian catastrophe at Europe's largest refugee camp.	
32184486		COVID-19: don't forget deaf people.	
32217547		Covid-19: Don't forget the impact on US family physicians.	
32152001		Covid-19: emergency departments lack proper isolation facilities, senior medic warns.	
32243318		COVID-19: emergency medicine perspectives from Hong Kong.	
32155302		COVID-19: Emerging compassion, courage and resilience in the face of misinformation and adversity.	
32205306		Covid-19: European drugs agency to review safety of ibuprofen.	
32213506		Covid-19: experts question analysis suggesting half UK population has been infected.	
32198178		Covid-19: experts question the evidence behind closing London Underground and city metros during the pandemic.	
32220654		COVID-19: extending or relaxing distancing control measures.	
32214231		COVID-19: faecal-oral transmission?	
32217555		Covid-19: FDA approves use of convalescent plasma to treat critically ill patients.	
32087777		COVID-19: fighting panic with information.	
32241884		Covid-19: four fifths of cases are asymptomatic, China figures indicate.	
32142785		COVID-19: Gastrointestinal manifestations and potential fecal-oral transmission.	
32200613		COVID-19: gastrointestinal symptoms and potential sources of 2019-nCoV transmission.	
32217532		Covid-19: Gilead withdraws orphan drug designation from potential treatment after criticism.	
32205317		Covid-19: give NHS staff rest spaces and free parking not thank yous, says doctor.	
32144111		Covid-19: GP surgeries close for two weeks after staff test positive.	
32165414		Covid-19: GPs call for appraisals and CQC inspections to be suspended.	
32169866		Covid-19: GPs call for same personal protective equipment as hospital doctors.	
32198147		Covid-19: GPs can stop health checks for over 75s and routine medicine reviews.	
32234831		Covid-19: healthcare staff in hotspot areas are prioritised as testing expands.	
32205309		Covid-19: Highest risk patients are asked to stay at home for 12 weeks.	
32132096		Covid-19: hoarding and misuse of protective gear is jeopardising the response, WHO warns.	
32220826		Covid-19: hospitals brace for disaster as US surpasses China in number of cases.	
32238346		Covid-19: Hospitals can remove 15% cap on testing of NHS staff.	
32229477		Covid-19: how coronavirus will change the face of general practice forever.	
32188598		Covid-19: how doctors and healthcare systems are tackling coronavirus worldwide.	
32213480		Covid-19: how to be careful with trust and expertise on social media.	
32184201		Covid-19: ibuprofen should not be used for managing symptoms, say doctors and scientists.	
32205334		Covid-19: identifying and isolating asymptomatic people helped eliminate virus in Italian village.	
32202260		COVID-19: Impact on health of people & wealth of nations.	
32217534		Covid-19: India imposes lockdown for 21 days and cases rise.	
32102793		Covid-19: Italy confirms 11 deaths as cases spread from north.	
32179508		Covid-19: junior doctor calls on colleagues to gather supplies for staff working long hours.	
32220878		Covid-19: Lack of PPE in care homes is risking spread of virus, leaders warn.	
32222181		COVID-19: learning from experience.	
32104909		COVID-19: Lessons from SARS and MERS.	
32222253		COVID-19: lessons from the Italian reproductive medical experience.	
32209551		Covid-19: local implementation of tracing and testing programmes could enable some schools to reopen.	
32169834		Covid-19: Medical conferences around the world are cancelled after US cases are linked to Massachusetts meeting.	
32179533		Covid-19: medical schools are urged to fast-track final year students.	
32217530		Covid-19: medical schools given powers to graduate final year students early to help NHS.	
32220863		Covid-19: medical students and FY1 doctors to be given early registration to help combat covid-19.	
32209588		Covid-19: medical students should not work outside their competency, says BMA.	
32198184		Covid-19: medical students to be employed by NHS as part of epidemic response.	
32229575		Covid-19: Mercedes F1 to provide breathing aid as alternative to ventilator.	
32209544		Covid-19: most patients require mechanical ventilation in first 24 hours of critical care.	
32238356		Covid-19: New York City deaths pass 1000 as Trump tells Americans to distance for 30 days.	
32167445		COVID-19: Not a Simple Public Health Emergency.	
32224711		COVID-19: one threat, one world, one response (magical thinking).	
32238956		COVID-19: One world, one health.	
32215807		COVID-19: opportunity arises from a world health crisis.	
32179567		Covid-19: outbreak could last until spring 2021 and see 7.9 million hospitalised in the UK.	
32152010		Covid-19: out-of-hours providers are drafted in to manage non-urgent patients in community.	
32220862		Covid-19: Over 300 Italian doctors and scientists call for more testing.	
32224232		COVID-19: Pandemic Contingency Planning for the Allergy and Immunology Clinic.	
32238978		Covid-19: Pandemonium in our time.	
32241813		Covid-19: Patients who are improving could have treatment withdrawn if others could benefit more.	
32116200		COVID-19: Perspectives on the Potential Novel Global Threat.	
32156675		Covid-19: Portugal closes all medical schools after 31 cases confirmed in the country.	
32188586		Covid-19: pregnant doctors should speak to occupational health, say experts.	
32111645		Covid-19: preparedness, decentralisation, and the hunt for patient zero.	
32113506		COVID-19: preparing for superspreader potential among Umrah pilgrims to Saudi Arabia.	
32210385		COVID-19: protect great apes during human pandemics.	
32199474		COVID-19: protecting health-care workers.	
32202635		Covid-19: Protecting Worker Health.	
32092748		COVID-19: Real-time dissemination of scientific information to fight a public health emergency of international concern.	
32220898		Covid-19: Researchers launch app to track spread of symptoms in the UK.	
32229768		COVID-19: response plan for International Medical Assistance companies.	
32122881		Covid-19: retired doctors could be asked to return to work, says Hancock.	
32217618		Covid-19: risk factors for severe disease and death.	
32156680		Covid-19: roundup of latest news.	
32241815		Covid-19: Rules on sharing confidential patient information are relaxed in England.	
32111656		Covid-19: school closures and bans on mass gatherings will need to be considered, says England's CMO.	
32193197		Covid-19: schools set to close across UK except for children of health and social care workers.	
32205321		Covid-19: six million doses of hydroxychloroquine donated to US despite lack of evidence.	
32187421		COVID-19: social distancing, ACE 2 receptors, protease inhibitors and beyond?	
32098875		Covid-19: surge in cases in Italy and South Korea makes pandemic look more likely.	
32151325		COVID-19: the gendered impacts of the outbreak.	
32171075		COVID-19: the medium is the message.	
32207680		COVID-19: the new challenge for rheumatologists.	
32226003		COVID-19: The outbreak caused by a new coronavirus.	
32192247		Covid-19: The right amount of wolf.	
32157235		COVID-19: time for WHO to reconsider its stance towards Taiwan.	
32145772		COVID-19: too little, too late?	
32197103		COVID-19: towards controlling of a pandemic.	
32184209		Covid-19: trainees will not move jobs in April.	
32209549		"Covid-19: trials of four potential treatments to generate ""robust data"" of what works."	
32165415		Covid-19: Trump cancels all flights from Europe, apart from the UK.	
32213487		"Covid-19: Trump declares intention to ""re-open economy"" within weeks against experts' advice."	
32229540		Covid-19: Trump extends physical distancing to 30 April, as cases climb in New York.	
32161091		Covid-19: Trump proposes tax cuts and improved health insurance, but millions are not covered.	
32107254		"Covid-19: Trump says risk to Americans is ""very low""."	
32184216		Covid-19: Trump sought to buy vaccine developer exclusively for US, say German officials.	
32161028		Covid-19: UK budget gives pound94 a week statutory sick pay to self-isolators and their carers.	
32127353		Covid-19: UK could delay non-urgent care and call doctors back from leave and retirement.	
32238344		Covid-19: UK deaths are higher than previously reported, new data suggest.	
32193352		Covid-19: UK government calls on industry to help boost testing capacity to 25 000 people a day.	
32169967		Covid-19: UK holds off closing schools and restricts testing to people in hospital.	
32209548		"Covid-19: UK lockdown is ""crucial"" to saving lives, say doctors and scientists."	
32160996		Covid-19: UK ramps up testing by 500% as health minister tests positive for virus.	
32144096		Covid-19: UK records first death, as world's cases exceed 100 000.	
32184205		Covid-19: UK starts social distancing after new model points to 260 000 potential deaths.	
32156677		Covid-19: UK trade talks with EU must not hinder cooperation in tackling threat, BMA warns.	
32241073		COVID-19: Uncharted waters	
32238355		Covid-19: US gives emergency approval to hydroxychloroquine despite lack of evidence.	
32122875		Covid-19: US health department staff sent to meet citizens returning from China weren't protected, claims whistleblower.	
32205342		Covid-19: US testing ramps up as early response draws harsh criticism.	
32238350		"Covid-19: Use radiotherapy only if ""unavoidable,"" says NICE."	
32197274		COVID-19: Vulnerability and the power of privilege in a pandemic.	
32129672		COVID-19: What Can We Learn From Stories From the Trenches?	
32220829		Covid-19: what do trainees need to know?	
32191167		COVID-19: What implications for sexual and reproductive health and rights globally?	
32061313		COVID-19: what is next for public health?	
32217754		Covid-19: What is the UK's testing strategy?	
32217607		Covid-19: what treatments are being investigated?	
32156682		Covid-19: What's the current advice for UK doctors?	
32165426		"Covid-19: WHO declares pandemic because of ""alarming levels"" of spread, severity, and inaction."	
32229543		Covid-19: why is the UK government ignoring WHO's advice?	
32112857		COVID-19: Zoonotic aspects.	
32228363		COVID-19-associated Acute Hemorrhagic Necrotizing Encephalopathy: CT and MRI Features.	
32191350		COVID-2019 and Pregnancy: A plea for transparent reporting of all cases.	
32083328		COVID-2019: The role of the nsp2 and nsp3 in its pathogenesis.	
32243911		C-reactive protein levels in the early stage of COVID-19.	
32240754		Creating a Palliative Care Inpatient Response Plan for COVID19 - The UW Medicine Experience.	
32185863		Crises drive innovation.	
32167538		Critical Care Utilization for the COVID-19 Outbreak in Lombardy, Italy: Early Experience and Forecast During an Emergency Response.	
32239213		Critical health literacy and the COVID-19 crisis.	
32207994		Critical Organizational Issues for Cardiologists in the COVID-19 Outbreak: A Frontline Experience From Milan, Italy.	
32212516		Critical Supply Shortages - The Need for Ventilators and Personal Protective Equipment during the Covid-19 Pandemic.	
31967321		Cross-species transmission of the newly identified coronavirus 2019-nCoV.	
32075877		Cryo-EM structure of the 2019-nCoV spike in the prefusion conformation.	
32198291		Crystal structure of SARS-CoV-2 main protease provides a basis for design of improved alpha-ketoamide inhibitors.	
32216640		CSC Expert Consensus on Principles of Clinical Management of Patients with Severe Emergent Cardiovascular Diseases during the COVID-19 Epidemic.	
32193883		CT appearance of severe, laboratory-proven coronavirus disease 2019 (COVID-19) in a Caucasian patient in Berlin, Germany.	
32134681		CT Features of Coronavirus Disease 2019 (COVID-19) Pneumonia in 62 Patients in Wuhan, China.	
32208010		CT Findings of Coronavirus Disease (COVID-19) Severe Pneumonia.	
32189175		CT image of novel coronavirus pneumonia: a case report.	
32215691		CT image visual quantitative evaluation and clinical classification of coronavirus disease (COVID-19).	
32129670		CT Imaging and Differential Diagnosis of COVID-19.	
32017661		CT Imaging Features of 2019 Novel Coronavirus (2019-nCoV).	
32003646		CT Imaging of the 2019 Novel Coronavirus (2019-nCoV) Pneumonia.	
32157862		CT Manifestations of Novel Coronavirus Pneumonia: A Case Report	
32031481		CT Manifestations of Two Cases of 2019 Novel Coronavirus (2019-nCoV) Pneumonia.	
32215898		CT morphology of COVID-19: Case report and review of literature.	
32222163		CT screening for early diagnosis of SARS-CoV-2 infection - Authors' reply.	
32222164		CT screening for early diagnosis of SARS-CoV-2 infection.	
32231323		Cull, release or bring them home: Coronavirus crisis forces hard decisions for labs with animals.	
32238757		Current Status of Epidemiology, Diagnosis, Therapeutics, and Vaccines for Novel Coronavirus Disease 2019 (COVID-19).	
32215952		Cutaneous manifestations in COVID-19: a first perspective.	
32238976		Cytokine storms in COVID-19 cases?	
32238353		David Oliver: Covid-19 will make us stop some activities for good.	
32213508		David Oliver: Covid-19-recriminations and political point scoring must wait.	
32227793		Dealing with COVID-19: initial perspectives of a small radiology department.	
32199105		Deciphering the power of isolation in controlling COVID-19 outbreaks.	
32238221		Declining Public Health Protections within Autocratic Regimes: Impact on Global Public Health Security, Infectious Disease Outbreaks, Epidemics, and Pandemics.	
32242828		Decreased "WBC*LYM" was observed in SARS-CoV-2-infected patients from a fever clinic in Wuhan.	
32205822		Deep Learning Localization of Pneumonia: 2019 Coronavirus (COVID-19) Outbreak.	
32074416		Defining the Epidemiology of Covid-19 - Studies Needed.	
32100024		De-isolating COVID-19 Suspect Cases: A Continuing Challenge.	
32130047		Deja Vu or Jamais Vu? How the Severe Acute Respiratory Syndrome Experience Influenced a Singapore Radiology Department's Response to the Coronavirus Disease (COVID-19) Epidemic.	
32240625		Dementia care during COVID-19.	
32238979		'Dental Hierarchy of Needs' in the COVID-19 Era - or Why Treat When It Doesn't Hurt?	
32213307		Dermatology practices as vectors for COVID-19 transmission: a call for immediate cessation of non-emergent dermatolgy visits.	
32201983		Dermatology staff participate in fight against Covid-19 in China.	
32222992		Detectable SARS-CoV-2 Viral RNA in Feces of Three Children during Recovery Period of COVID-19 Pneumonia.	
32243608		Detection of antibodies against SARS-CoV-2 in patients with COVID-19.	
32163697		Detection of Covid-19 in Children in Early January 2020 in Wuhan, China.	
32150527		Detection of Novel Coronavirus by RT-PCR in Stool Specimen from Asymptomatic Child, China.	
32221133		Detection of serum immunoglobulin M and immunoglobulin G antibodies in 2019-novel coronavirus infected cases from different stages.	
32227757		Developing Covid-19 Vaccines at Pandemic Speed.	
32104917		Development and Clinical Application of A Rapid IgM-IgG Combined Antibody Test for SARS-CoV-2 Infection Diagnosis.	
32156101		Development of a Laboratory-safe and Low-cost Detection Protocol for SARS-CoV-2 of the Coronavirus Disease 2019 (COVID-19).	
32239445		Development of a Novel Reverse Transcription Loop-Mediated Isothermal Amplification Method for Rapid Detection of SARS-CoV-2.	
32108359		Development of epitope-based peptide vaccine against novel coronavirus 2019 (SARS-COV-2): Immunoinformatics approach.	
32074516		Development of Genetic Diagnostic Methods for Novel Coronavirus 2019 (nCoV-2019) in Japan.	
32242876		Development of in vitro transcribed RNA as positive control for laboratory diagnosis of SARS-CoV-2 in India.	
32219627		Development Path and Urgency of further Strengthening Construction of Public Hospitals Based on Novel Coronavirus Pneumonia Treatment.	
32162476		Diabetes and COVID-19.	
32233013		Diabetes is a risk factor for the progression and prognosis of COVID-19.	
32223179		Diagnosing COVID-19: The Disease and Tools for Detection.	
32223716		Diagnosis and Management of COVID-19 Disease.	
32026147		Diagnosis and treatment of 2019 novel coronavirus infection in children: a pressing issue.	
32227488		Diagnosis and Treatment of an Acute Severe Pneumonia Patient with COVID-19: Case Report.	
32209888		Diagnosis and Treatment Plan for COVID-19 (Trial Version 6).	
32026148		Diagnosis and treatment recommendations for pediatric respiratory infection caused by the 2019 novel coronavirus.	
32147407		Diagnosis of SARS-CoV-2 Infection based on CT scan vs. RT-PCR: Reflecting on Experience from MERS-CoV.	
32034659		Diagnosis, treatment, and prevention of 2019 novel coronavirus infection in children: experts' consensus statement.	
32238427		Diagnostic evaluation of pulmonary embolism during the COVID-19 pandemic.	
32232648		Diagnostic performance of chest CT to differentiate COVID-19 pneumonia in non-high-epidemic area in Japan.	
32150622		Diagnostic Testing for the Novel Coronavirus.	
32181911		Diagnostic Utility of Clinical Laboratory Data Determinations for Patients with the Severe COVID-19.	
32241244		Diagnostic Value and Key Features of Computed Tomography in Coronavirus Disease 2019.	
32196453		Diagnostic Value of Chest CT in Coronavirus Disease 2019 (COVID-19).	
32102928		Diarrhoea may be underestimated: a missing link in 2019 novel coronavirus.	
32178767		Did the hesitancy in declaring COVID-19 a pandemic reflect a need to redefine the term?	
32196628		Differences and similarities between Severe Acute Respiratory Syndrome (SARS)-CoronaVirus (CoV) and SARS-CoV-2. Would a rose by another name smell as sweet?	
32237148		Differences between COVID-19 and suspected then confirmed SARS-CoV-2-negative pneumonia: a retrospective study from a single center.	
32239972		Differential Diagnosis for Coronavirus Disease (COVID-19): Beyond Radiologic Features.	
32147628		Discovering drugs to treat coronavirus disease 2019 (COVID-19).	
32074261		Discussing the ABCs of Health Security-Antibiotic Resistance, Biothreats, and Coronavirus.	
32232322		Disparities in Age-Specific Morbidity and Mortality from SARS-CoV-2 in China and the Republic of Korea.	
32106462		Disposable DNA Amplification Chips with Integrated Low-Cost Heaters.	
32212240		Disseminated intravascular coagulation in patients with 2019-nCoV pneumonia.	
32118644		Distribution of the COVID-19 epidemic and correlation with population emigration from wuhan, China.	
32224116		Do children need a longer time to shed SARS-CoV-2 in stool than adults?	
32061311		Do not violate the International Health Regulations during the COVID-19 outbreak.	
32241584		Do we correctly comply with prevention protocols in ophthalmology? About the latest coronavirus epidemic.	
32209559		Doctors' wellbeing: self-care during the covid-19 pandemic.	
32238438		Does COVID19 infect the brain? If so, smokers might be at a higher risk.	
32221693		Does hand hygiene reduce SARS-CoV-2 transmission?	
32056235		Does SARS-CoV-2 has a longer incubation period than SARS and MERS?	
32209542		Don't forget chronic lung and immune conditions during covid-19, says WHO.	
32205220		Don't overlook digestive symptoms in patients with 2019 novel coronavirus disease (COVID-19).	
32179860		Don't rush to deploy COVID-19 vaccines and drugs without sufficient safety guarantees.	
32238428		Dr. Li Wenliang and the Time of COVID-19.	
31996494		Drug treatment options for the 2019-new coronavirus (2019-nCoV).	
32241880		Drugs and the renin-angiotensin system in covid-19.	
32151674		Duration of quarantine in hospitalized patients with severe acute respiratory syndrome coronavirus 2 (SARS-CoV-2) infection: a question needing an answer.	
