#PMID	PMCID	TITLE	LANGUAGE
32187007		Identifying and Interrupting Superspreading Events-Implications for Control of Severe Acute Respiratory Syndrome Coronavirus 2.	
32207679		Identifying Locations with Possible Undetected Imported Severe Acute Respiratory Syndrome Coronavirus 2 Cases by Using Importation Predictions.	
32218527		Identifying SARS-CoV-2 related coronaviruses in Malayan pangolins.	
32243334		Images in Clinical ECT: Immediate impact of COVID-19 on ECT Practice.	
32242947		Imaging and Clinical Features of Patients With 2019 Novel Coronavirus SARS-CoV-2: A systematic review and meta-analysis.	
32238430		Imaging clinic operations in the times of COVID-19: Strategies, Precautions and Experiences.	
32204990		Imaging Features of Coronavirus disease 2019 (COVID-19): Evaluation on Thin-Section CT.	
32215535		Immediate Health Surveillance Response to COVID-19 Epidemic.	
32105090		Immune responses in COVID-19 and potential vaccines: Lessons learned from SARS and MERS epidemic.	
32237901		Immune-epidemiological parameters of the novel coronavirus - a perspective.	
32022276		Immunoinformatics-aided identification of T cell and B cell epitopes in the surface glycoprotein of 2019-nCoV.	
32243698		Immunosuppression drug-related and clinical manifestation of Coronavirus disease 2019: a therapeutical hypothesis.	
32220278		Immunosuppression for hyperinflammation in COVID-19: a double-edged sword?	
32182131		Impact of Coronavirus Disease 2019 (COVID-19) Outbreak on ST-Segment-Elevation Myocardial Infarction Care in Hong Kong, China.	
32237972		Impact of COVID-19 and Future Emerging Viruses on Hematopoietic Cell Transplantation and Other Cellular Therapies.	
32175719		Impact of COVID-19 outbreak on rehabilitation services and Physical and Rehabilitation Medicine (PRM) physicians' activities in Italy. An official document of the Italian PRM Society (SIMFER).	
32170017		Impact of international travel and border control measures on the global spread of the novel 2019 coronavirus outbreak.	
32243776		Impacts of COVID-19 on vulnerable children in temporary accommodation in the UK.	
32233973		Implications for Online Management: Two Cases with COVID-19.	
31991079		Importation and Human-to-Human Transmission of a Novel Coronavirus in Vietnam.	
32119807		Imported Novel Coronavirus Infections: Observation on Active and Passive Case Detection in Thailand.	
32132196		Improved molecular diagnosis of COVID-19 by the novel, highly sensitive and specific COVID-19-RdRp/Hel real-time reverse transcription-polymerase chain reaction assay validated in vitro and with clinical specimens.	
32033967		In Beijing, coronavirus 2019-nCoV has created a siege mentality.	
32220991		In other Covid-19 news.	
32221132		In Silico assessment of the impact of 2019 novel coronavirus (2019-nCoV) genomic variation on published real-time quantitative polymerase chain reaction detection assays.	
32243951		Inactivation of coronaviruses by heat.	
32238429		INCIDENTAL FINDINGS SUGGESTIVE OF COVID-19 IN ASYMPTOMATIC PATIENTS UNDERGOING NUCLEAR MEDICINE PROCEDURES IN A HIGH PREVALENCE REGION.	
32113494		Indian pharma threatened by COVID-19 shutdowns in China.	
32163030		Indirect Virus Transmission in Cluster of COVID-19 Cases, Wenzhou, China, 2020.	
32171193		Induction of pro-inflammatory cytokines (IL-1 and IL-6) and lung inflammation by Coronavirus-19 (COVI-19 or SARS-CoV-2): anti-inflammatory strategies.	
32236815		Inefficiency of Sera from Mice Treated with Pseudotyped SARS-CoV to Neutralize 2019-nCoV Infection.	
32241929		Infect volunteers to speed a coronavirus vaccine?	
32236854		Infection control protocol inside computed tomography suites during COVID-19 outbreak.	
32053437		Infections without borders: a new coronavirus in Wuhan, China.	
32241761		Infectious diseases in children and adolescents in China: analysis of national surveillance data from 2008 to 2017.	
32211765		Inflammatory bowel disease care in the COVID-19 pandemic era: the Humanitas, Milan experience.	
32231345		Inhibition of SARS-CoV-2 (previously 2019-nCoV) infection by a highly potent pan-coronavirus fusion inhibitor targeting its spike protein that harbors a high capacity to mediate membrane fusion.	
32167181		Initial clinical features of suspected coronavirus disease 2019 in two emergency departments outside of Hubei, China.	
32221172		Initial Clinical Impressions of the Critical Care of COVID-19 Patients in Seattle, New York City, and Chicago.	
32232395		Initial COVID-19 affecting cardiac patients in China.	
32055945		Initial CT findings and temporal changes in patients with the novel coronavirus pneumonia (2019-nCoV): a study of 63 patients in Wuhan, China.	
32243267		Initial ELSO Guidance Document: ECMO for COVID-19 Patients with Severe Cardiopulmonary Failure.	
32216893		Initial Experience of an Emergency Department in Shenzhen in Responding to the Emerging Wuhan Coronavirus Pneumonia.	
32191689		Initial Investigation of Transmission of COVID-19 Among Crew Members During Quarantine of a Cruise Ship - Yokohama, Japan, February 2020.	
32090470		Initial public health response and interim clinical guidance for the 2019 novel coronavirus outbreak - United States, December 31, 2019-February 4, 2020.	
32085850		Initiation of a new infection control system for the COVID-19 outbreak.	
32217104		Inside China and COVID-19: Questions and answers.	
32187887		Insight into COVID-2019 for pediatricians.	
32142930		Insights into the cross-species evolution of 2019 novel coronavirus.	
32143502		Insights into the Recent 2019 Novel Coronavirus (SARS-CoV-2) in Light of Past Human Coronavirus Outbreaks.	
32238078		In-silico approaches to detect inhibitors of the human severe acute respiratory syndrome coronavirus envelope protein ion channel.	
32229082		Integrative considerations during the COVID-19 pandemic.	
32231328		Interaction between RAAS inhibitors and ACE2 in the context of COVID-19.	
32241520		International Guidelines on Radiation Therapy for Breast Cancer During the COVID-19 Pandemic.	
32223581		International Perspectives Concerning Donor Milk Banking During the SARS-CoV-2 (COVID-19) Pandemic.	
32205090		Interrupting COVID-19 transmission by implementing enhanced traffic control bundling: Implications for global prevention and control efforts.	
32229433		Interventional radiology and COVID-19: evidence-based measures to limit transmission.	
32213332		Interventions to mitigate early spread of SARS-CoV-2 in Singapore: a modelling study.	
32233040		Intranasal corticosteroids in allergic rhinitis in COVID-19 infected patients: An ARIA-EAACI statement.	
32227642		Introducing the 21st Century's New Four Horsemen of the Coronapocalypse.	
32195705		Intubation and Ventilation amid the COVID-19 Outbreak: Wuhan's Experience.	
32192580		Investigation of three clusters of COVID-19 in Singapore: implications for surveillance and response measures.	
32167442		Involving Antimicrobial Stewardship Programs in COVID-19 Response Efforts: All Hands on Deck.	
32163908		Iranian mental health during the COVID-19 epidemic.	
32119980		Is Africa prepared for tackling the COVID-19 (SARS-CoV-2) epidemic. Lessons from past outbreaks, ongoing pan-African public health efforts, and implications for the future.	
32189428		Is nicotine exposure linked to cardiopulmonary vulnerability to COVID-19 in the general population?	
32176356		Is novel coronavirus disease (COVID-19) transmitted through conjunctiva?	
32237161		Is Pakistan prepared for the COVID-19 epidemic? A questionnaire-based survey.	
32227844		Is Regional Anesthesia Enough Safe in Suspected or Confirmed COVID-19 Patients?	
32184128		Is Romania ready to face the novel coronavirus (COVID-19) outbreak? The role of incoming travelers and that of Romanian diaspora.	
32148173		Is SARS-CoV-2 originated from laboratory? A rebuttal to the claim of formation via laboratory recombination.	
32242113		Is the coronavirus airborne? Experts can't agree.	
32198775		Is there a role for lung ultrasound during the COVID-19 pandemic?	
32215613		Is There an Association Between COVID-19 Mortality and the Renin-Angiotensin System-a Call for Epidemiologic Investigations.	
32240279		Isolated sudden onset anosmia in COVID-19 infection. A novel syndrome?	
32238585		Isolation and full-length genome characterization of SARS-CoV-2 from COVID-19 cases in Northern Italy.	
32237278		Isolation and rapid sharing of the 2019 novel coronavirus (SAR-CoV-2) from the first patient diagnosed with COVID-19 in Australia.	
32233049		ISUOG Consensus Statement on organization of routine and specialist obstetric ultrasound services in the context of COVID-19.	
32160345		ISUOG Interim Guidance on 2019 novel coronavirus infection during pregnancy and puerperium: information for healthcare professionals.	
32207189		ISUOG Safety Committee Position Statement: safe performance of obstetric and gynecological scans and equipment cleaning in the context of COVID-19.	
32217525		Italian doctors call for protecting healthcare workers and boosting community surveillance during covid-19 outbreak.	
32223063		Italian Society of Interventional Cardiology (GISE) Position Paper for Cath lab-specific Preparedness Recommendations for Healthcare providers in case of suspected, probable or confirmed cases of COVID-19.	
32213700		Italy in a Time of Emergency and Scarce Resources: The Need for Embedding Ethical Reflection in Social and Clinical Settings.	
32188776		Journal Flexibility in the Troubling Times of COVID-19.	
32050060		Journey of a Thai Taxi Driver and Novel Coronavirus.	
32223782		Just the Facts: Airway management during the COVID-19 pandemic.	
32238197		Just the Facts: Protecting frontline clinicians during the COVID-19 pandemic.	
32157233		Keep up with the latest coronavirus research.	
32223870		Keeping the Fire House Running: A Proposed Approach to Mitigate Spread of COVID-19 Among Public Safety Personnel.	
32207256		Key Considerations for Radiologists When Diagnosing the Novel Coronavirus Disease (COVID-19).	
32172227		Laboratory abnormalities in children with novel coronavirus disease 2019.	
32119647		Laboratory abnormalities in patients with COVID-2019 infection.	
32196430		Laboratory Diagnosis of Emerging Human Coronavirus Infections - The State of the Art.	
32242830		Laboratory diagnostics within a modular hospital at the time of Coronavirus disease 2019 (COVID-19) in Wuhan.	
32242875		Laboratory preparedness for SARS-CoV-2 testing in India: Harnessing a network of Virus Research & Diagnostic Laboratories.	
32152596		Labs rush to study coronavirus in transgenic animals - some are in short supply.	
32054740		Labs scramble to produce new coronavirus diagnostics.	
32201338		Lack of SARS-CoV-2 RNA environmental contamination in a tertiary referral hospital for infectious diseases in Northern Italy.	
32134381		Lack of Vertical Transmission of Severe Acute Respiratory Syndrome Coronavirus 2, China.	
32222113		Learning from history: Coronavirus outbreaks in the past.	
32022370		Learning from the Past: Possible Urgent Prevention and Treatment Options for Severe Acute Respiratory Infections Caused by 2019-nCoV.	
32113507		Lessons for managing high-consequence infections from first COVID-19 cases in the UK.	
32241778		Lessons from the Experience in Wuhan to Reduce Risk of COVID-19 Infection in Patients Undergoing Long-Term Hemodialysis.	
32243298		Lessons learned from first COVID-19 cases in the United States.	
32241308		Lessons Learned From Korea: Covid-19 Pandemic.	
32243722		Lessons unfolding from pediatric cases of COVID-19 disease caused by SARS-CoV-2 infection.	
32233055		Lest we forget.	
32243191		"Letter by Pilz et al Regarding Article, ""Impact of Coronavirus Disease 2019 (COVID-19) Outbreak on ST-Elevation Myocardial Infarction Care in Hong Kong, China""."	
32075783		Letter from China: covid-19 on the grapevine, on the internet, and in commerce.	
32171807		Letter from the Editor: Occupational skin disease among healthcare workers during the Coronavirus (COVID-19) epidemic.	
32192550		Letter to editor: Role of masks/respirator protection against 2019-novel coronavirus (COVID-19).	
32233443		Letter to the Editor.	
32242901		Letter: The Coronavirus Disease 2019 Global Pandemic: A Neurosurgical Treatment Algorithm.	
32212392		Leukoerythroblastic reaction in a patient with COVID-19 infection.	
32142979		Li Wenliang, a face to the frontline healthcare worker. The first doctor to notify the emergence of the SARS-CoV-2, (COVID-19), outbreak.	
32227076		Life-threatening cardiac tamponade complicating myo-pericarditis in COVID-19.	
32240633		Likelihood of survival of coronavirus disease 2019.	
32241328		Limited early warnings and public attention to COVID-19 in China, January-February, 2020: a longitudinal cohort of randomly sampled Weibo users.	
32239796		Liver impairment in COVID-19 patients: a retrospective analysis of 115 cases from a single center in Wuhan city, China.	
32170806		Liver injury during highly pathogenic human coronavirus infections.	
32145190		Liver injury in COVID-19: management and challenges.	
32242111		Lockdown in Italy: personal stories of doing science during the COVID-19 quarantine.	
32179000		Long-Term Care Facilities and the Coronavirus Epidemic: Practical Guidelines for a Population at Highest Risk.	
32220989		Looking after yourself and others.	
32113508		Looming threat of COVID-19 infection in Africa: act collectively, and fast.	
32202256		Lopinavir/ritonavir combination therapy amongst symptomatic coronavirus disease 2019 patients in India: Protocol for restricted public health emergency use.	
32243566		Los derechos humanos de los ninos con discapacidad durante emergencias sanitarias: el desafio de COVID-19.	
32200645		Lung Recruitability in SARS-CoV-2 Associated Acute Respiratory Distress Syndrome: A Single-center, Observational Study.	
32234724		Lung ultrasound findings in a 64-year-old woman with COVID-19.	
32145214		Lymphopenic community acquired pneumonia as signature of severe COVID-19 infection.	
32142596		Machine Learning, COVID-19 (2019-nCoV), and multi-OMICS.	
32169615		Makeshift hospitals for COVID-19 patients: where health-care workers and patients need sufficient ventilation for more protection.	
32241949		Making allowances for COVID-19.	
32215647		Management of Critically Ill Adults With COVID-19.	
32214232		Management of IBD during the COVID-19 outbreak: resetting clinical priorities.	
32220285		Management of pregnant women infected with COVID-19.	
32112336		Management strategies of neonatal jaundice during the coronavirus disease 2019 outbreak.	
32209526		Management strategy of novel coronavirus (COVID-19) pneumonia in the radiology department: a Chinese experience.	
32197238		Managing Cancer Care During the COVID-19 Pandemic: Agility and Collaboration Toward a Common Goal.	
32176764		Managing COVID-19 in Low- and Middle-Income Countries.	
32209891		Managing COVID-19 in Surgical Systems.	
32201224		Managing COVID-19 in the oncology clinic and avoiding the distraction effect.	
32217624		Managing mental health challenges faced by healthcare workers during covid-19 pandemic.	
32151318		Managing neonates with respiratory failure due to SARS-CoV-2 - Authors' reply.	
32151320		Managing neonates with respiratory failure due to SARS-CoV-2.	
32216653		Managing Oncology Services During a Major Coronavirus Outbreak: Lessons From the Saudi Arabia Experience.	
32044387		Maps, masks and media - Traveller and practitioner resources for 2019 novel coronavirus (2019-nCoV) acute respiratory virus.	
32203693		Mass gathering events and reducing further global spread of COVID-19: a political and public health dilemma.	
32142626		Mass masking in the COVID-19 epidemic: people need guidance.	
32219871		Maternal health care management during the outbreak of coronavirus disease 2019 (COVID-19).	
32240770		Maximizing the Calm Before the Storm: Tiered Surgical Response Plan for Novel Coronavirus (COVID-19).	
32238614		Measles Immunization: Worth Considering Containment Strategy for SARS-CoV-2 Global Outbreak.	
32207255		Mediastinal Emphysema, Giant Bulla, and Pneumothorax Developed during the Course of COVID-19 Pneumonia.	
32233098		Medical Education Adaptations: Really Good Stuff for Educational Transition during a Pandemic.	
32219888		Medical education and care in dermatology during the SARS-CoV2 pandemia: challenges and chances.	
31986242		Medical Journals and the 2019-nCoV Outbreak.	
32232420		Medical Student Education in the Time of COVID-19.	
32243779		Medicine: before COVID-19, and after.	
32233168		Mental Health and Psychological Intervention Amid COVID-19 Outbreak: Perspectives from South Korea.	
32085839		Mental health care for medical staff in China during the COVID-19 outbreak.	
32227218		Mental health in the Covid-19 pandemic.	
32085843		Mental health services for older adults in China during the COVID-19 outbreak.	
32200399		Mental Health Strategies to Combat the Psychological Impact of COVID-19 Beyond Paranoia and Panic.	
32243846		Message from the Editor: Stem Cell Science in the Time of COVID-19.	
32225177		Methanol Mass Poisoning Outbreak: A Consequence of COVID-19 Pandemic and Misleading Messages on Social Media.	
32145185		Middle East respiratory syndrome.	
32227596		Migraine Care in the Era of COVID-19: Clinical Pearls and Plea to Insurers.	
32202647		Mimics and chameleons of COVID-19.	
32221118		Minimally Invasive Surgery and the Novel Coronavirus Outbreak: Lessons Learned in China and Italy.	
32059800		Minimise nosocomial spread of 2019-nCoV when treating acute respiratory failure.	
32198292		Misguided drug advice for COVID-19.	
32145186		Mitigate the effects of home confinement on children during the COVID-19 outbreak.	
32198130		Mitigating Risk of COVID-19 in Dialysis Facilities.	
32238673		Mobile field hospitals, an effective way of dealing with COVID-19 in China: sharing our experience.	
32234449		Molecular characterization of SARS-CoV-2 in the first COVID-19 cluster in France reveals an amino-acid deletion in nsp2 (Asp268Del).	
32071447		More than 80 clinical trials launch to test coronavirus treatments.	
32228738		Mortality rate of infection with COVID-19 in Korea from the perspective of underlying disease.	
32234303		Multi-omics Evaluation of Gastrointestinal and Other Clinical Characteristics of SARS-CoV-2 and COVID-19.	
32238896		My lab is closed to me because of the coronavirus. Here's how I'm planning to stay productive.	
32127703		Mystery deepens over animal source of coronavirus.	
32220277		National UK programme of community health workers for COVID-19 response.	
32191676		Natural small molecules as inhibitors of coronavirus lipid-dependent attachment to host cells: a possible strategy for reducing SARS-COV-2 infectivity?	
32196983		Navigating Coronavirus Disease 2019 (Covid-19) in Physiatry: A CAN report for Inpatient Rehabilitation Facilities.	
32202259		Need for integrated surveillance at human-animal interface for rapid detection & response to emerging coronavirus infections using One Health approach.	
32102856		Negative Nasopharyngeal and Oropharyngeal Swab Does Not Rule Out COVID-19.	
32219398		Negligible risk of the COVID-19 resurgence caused by work resuming in China (outside Hubei): a statistical probability study.	
32240762		Nervous system involvement after infection with COVID-19 and other coronaviruses.	
32233641		Network pharmacology-based analysis of the role of traditional Chinese herbal medicines in the treatment of COVID-19.	
32221171		Neuraxial procedures in COVID-19 positive parturients: a review of current reports.	
32223077		Neuroinfection may potentially contribute to pathophysiology and clinical manifestations of COVID-19.	
32229625		Neurologic complications of coronavirus infections.	
32238504		Neurologists and Covid-19: A note on courage in a time of uncertainty.	
32222820		Neurosurgery during the COVID-19 pandemic: update from Lombardy, northern Italy.	
32242950		Neutrophil-to-Lymphocyte ratio and Lymphocyte-to-C-reactive protein ratio in patients with severe coronavirus disease 2019 (COVID-19): A meta-analysis.	
32161107		New coronavirus outbreak: Framing questions for pandemic prevention.	
32001631		New coronavirus threat galvanizes scientists.	
32037473		New coronavirus: new challenges for pediatricians.	
32209313		New therapeutic opportunities for COVID-19 patients with Tocilizumab: Possible correlation of interleukin-6 receptor inhibitors with osteonecrosis of the jaws.	
32242173		New Zealand's elimination strategy for the COVID-19 pandemic and what is required to make it work.	
32229574		News Feature: Avoiding pitfalls in the pursuit of a COVID-19 vaccine.	
32161414		Nigeria responds to COVID-19; first case detected in sub-Saharan Africa.	
32240719		No Evidence of Rapid Antiviral Clearance or Clinical Benefit with the Combination of Hydroxychloroquine and Azithromycin in Patients with Severe COVID-19 Infection.	
32099125		'No one is allowed to go out': your stories from the coronavirus outbreak.	
32097201		Non-invasive respiratory support for patients with novel coronavirus pneumonia: clinical efficacy and reduction in risk of infection transmission.	
32220865		Non-steroidal anti-inflammatory drugs and covid-19.	
32207910		Novel 2019 coronavirus SARS-CoV-2 (COVID-19): An updated overview for emergency clinicians	
32132669		Novel antibody epitopes dominate the antigenicity of spike glycoprotein in SARS-CoV-2 compared to SARS-CoV.	
32141062		Novel corona virus disease (COVID-19) in pregnancy: What clinical recommendations to follow?	
32092391		Novel coronavirus (2019-nCoV) cases in Hong Kong and implications for further spread.	
32162679		Novel Coronavirus (COVID-19) Epidemic: What Are the Risks for Older Patients?	
32048818		Novel coronavirus (SARS-CoV-2) epidemic: a veterinary perspective.	
32238612		Novel Coronavirus 2019 (2019-nCoV) Infection: Part I - Preparedness and Management in the Pediatric Intensive Care Unit in Resource-limited Settings.	
32238613		Novel Coronavirus 2019 (2019-nCoV) Infection: Part II - Respiratory Support in the Pediatric Intensive Care Unit in Resource-limited Settings.	
32141586		Novel Coronavirus 2019 (Sars-CoV2): a global emergency that needs new approaches?	
32195702		Novel Coronavirus 2019 and Anesthesiology.	
32077206		Novel coronavirus 2019, an emerging public health emergency.	
32141570		Novel coronavirus 2019-nCoV: prevalence, biological and clinical characteristics comparison with SARS-CoV and MERS-CoV.	
32216009		Novel coronavirus and central nervous system.	
32212515		Novel Coronavirus and Old Lessons - Preparing the Health System for the Pandemic.	
32205660		Novel Coronavirus and Orthopaedic Surgery: Early Experiences from Singapore.	
32105049		Novel coronavirus COVID-19: an overview for emergency clinicians	
32243302		Novel Coronavirus COVID-19: Current Evidence and Evolving Strategies.	
32160942		Novel coronavirus disease (COVID-19) outbreak: Now is the time to refresh pandemic plans.	
32119884		Novel coronavirus disease (Covid-19): The first two patients in the UK with person to person transmission.	
32086236		Novel Coronavirus disease 2019 (COVID-19): The importance of recognising possible early ocular manifestation and using protective eyewear.	
32233816		Novel coronavirus in a 15-day-old neonate with clinical signs of sepsis, a case report.	
32235486		Novel Coronavirus Infection (COVID-19) in Humans: A Scoping Review and Meta-Analysis.	
32134165		Novel coronavirus infection and pregnancy.	
32032614		Novel coronavirus is putting the whole world on alert.	
32227091		Novel Coronavirus Pneumonia (COVID-19) Progression Course in 17 Discharged Patients: Comparison of Clinical and Thin-Section CT Features During Recovery.	
32068012		Novel coronavirus pneumonia emergency in Zhuhai: impact and challenges.	
32209502		Novel coronavirus SARS-CoV-2: familial spread resulting in COVID-19 pneumonia in a pediatric patient.	
32227493		Novel coronavirus treatment with ribavirin: Groundwork for evaluation concerning COVID-19.	
32057788		Novel coronavirus, poor quarantine, and the risk of pandemic.	
32024636		Novel coronavirus: Australian GPs raise concerns about shortage of face masks.	
32007627		Novel coronavirus: From discovery to clinical diagnostics.	
32058086		Novel coronavirus: how things are in Wuhan.	
32198164		Novel Coronavirus: What Neuroradiologists as Citizens of the World Need to Know.	
32233057		Novel Coronavirus-19 (COVID-19) in the Immunocompromised Transplant Recipient: #Flatteningthecurve.	
32004066		Novel Wuhan (2019-nCoV) Coronavirus.	
32014114		Nowcasting and forecasting the potential domestic and international spread of the 2019-nCoV outbreak originating in Wuhan, China: a modelling study.	
32225133		Number of COVID-19 cases in Chile at 120 days with data at 21/03/2020 and threshold of daily effort to flatten the epi-curve.	
32202336		Nursing and the Novel Coronavirus: Risks and Responsibilities in a Global Outbreak.	
32237206		Obesity and its Implications for COVID-19 Mortality.	
32232568		Ocular manifestation, eye protection, and COVID-19.	
32147496		Of chloroquine and COVID-19.	
32007152		Offline: 2019-nCoV outbreak-early lessons.	
32035537		"Offline: 2019-nCoV-""A desperate plea""."	
32222186		"Offline: COVID-19 and the NHS-""a national scandal""."	
32199478		Offline: COVID-19-a reckoning.	
32103304		Old Threat, New Enemy: Is Your Interventional Radiology Service Ready for the Coronavirus Disease 2019?	
32227200		Older Clinicians and the Surge in Novel Coronavirus Disease 2019 (COVID-19).	
32239784		Older people and COVID-19: Isolation, risk and ageism.	
32227214		Older people and epidemics: a call for empathy.	
32152612		On a knife's edge of a COVID-19 pandemic: is containment still possible?	
